HS Code,ProductDescription,Shipper Name,Consignee Name,StandardQty,Country Of Origin,CountryofDestination,
09109100,SPICE MIX FOR FISH MASALA200GMS -# UK -,*****,*****,36,India,United Kingdom,
09109100,SPICE MIX FOR GARAM MASALA 100GMS -# UK,*****,*****,36,India,United Kingdom,
09109100,SPICE MIX FOR MEAT MASALA200GMS - UK - 1,*****,*****,120,India,United Kingdom,
09109100,SPICE MIX FOR CHICKEN MASALA 200GMS - UK,*****,*****,120,India,United Kingdom,
09109100,SPICE MIX FOR BIRIYANI MASALA 100GM - UK,*****,*****,21.60,India,United Kingdom,
09109100,SPICE MIX FOR SAMBHAR POWDER 200GMS - UK,*****,*****,120,India,United Kingdom,
09109100,SPICE MIX FOR MEATULARTHUMASALA 100GMS-U,*****,*****,21.60,India,United Kingdom,
09109100,SPICES MW CHICKEN TIKKA MIX 80 G X 72 PO,*****,*****,25,India,United Kingdom,
09109100,SPICES MW CHICKEN JALFREI MIX 50 G X 72,*****,*****,25,India,United Kingdom,
09109100,SPICES MW CHICKEN CURRY MIX 80 G X 72 PO,*****,*****,25,India,United Kingdom,
09109100,SPICES MW BUTTER CHICKEN MIX 50 G X 72 P,*****,*****,25,India,United Kingdom,
73239420,DESIGNER SPICE CONTAINER MASALA DABBA,*****,*****,40,India,United Kingdom,
80070090,"INDIAN 8"" Tin Plate Spice Box - KC279",*****,*****,45,India,United Kingdom,
44209090,INDIAN WOODEN BOX Wooden Spice Box,*****,*****,550,India,United Kingdom,
12119099,NATURES SAPPAN WOOD & SPICE MAX,*****,*****,25,India,United Kingdom,
44219990,WOODEN SPICE BOX,*****,*****,20,India,United Kingdom,
33019090,FRAGRANCE OIL-10ML-WINTER SPICE-22,*****,*****,462.50,India,United Kingdom,
09109929,BLENDED SPICES 20 X 3.5 Oz,*****,*****,10,India,United Kingdom,
19059040,PUPPODOMS SPICED 1800NOS X240CTNS PACK,*****,*****,432000,India,United Kingdom,
44219190,Spice box for indian masala kitchen,*****,*****,1,India,United Kingdom,
39239090,Plastic masla spice box multi coloured 7,*****,*****,10,India,United Kingdom,
44219190,masala spice box for kitchen,*****,*****,1,India,United Kingdom,
09109100,SPICES MASALA POWDER & PASTE - Spice - M,*****,*****,270,India,United Kingdom,
09109100,SPICES MASALA POWDER & PASTE - Vangibath,*****,*****,225,India,United Kingdom,
09109100,SPICES MASALA POWDER & PASTE - Spice - S,*****,*****,360,India,United Kingdom,
44219990,HANDICRAFTS OF ACACIA WOOD/ SPICE BOX W/,*****,*****,104,India,United Kingdom,
44219990,HANDICRAFTS OF ACACIA WOOD/ SPICE BOX W/,*****,*****,104,India,United Kingdom,
09109100,SPICES MASALA POWDER & PASTE - Spice-Pul,*****,*****,288,India,United Kingdom,
09109100,SPICES MASALA POWDER & PASTE - Spice - S,*****,*****,360,India,United Kingdom,
39232990,SPICE ROOT-210MM W X 280MM HX50+50MM GUS,*****,*****,2400,India,United Kingdom,
39232990,SPICE ROOT-170MM W X 265MM HX45+45MM GUS,*****,*****,2400,India,United Kingdom,
44219960,Mango wood Spice Box round shape carved,*****,*****,91,India,United Kingdom,
73239390,STAINLESS STEEL SPICE BOX,*****,*****,32,India,United Kingdom,
39241090,PLASTIC CROCKERY AND UTENSIL Spice,*****,*****,360,India,United Kingdom,
39241090,PLASTIC CROCKERY AND UTENSIL Spice,*****,*****,78,India,United Kingdom,
39241090,PLASTIC CROCKERY AND UTENSIL Spice,*****,*****,105,India,United Kingdom,
39241090,PLASTIC CROCKERY AND UTENSIL Spice,*****,*****,720,India,United Kingdom,
39241090,PLASTIC CROCKERY AND UTENSIL Spice,*****,*****,180,India,United Kingdom,
39241090,PLASTIC CROCKERY AND UTENSIL Spice,*****,*****,192,India,United Kingdom,
39241090,PLASTIC CROCKERY AND UTENSIL Spice,*****,*****,336,India,United Kingdom,
39241090,PLASTIC CROCKERY AND UTENSIL Spice,*****,*****,1176,India,United Kingdom,
33074900,FRAGRANCE OIL 10ML-WINTER SPICE-22,*****,*****,224,India,United Kingdom,
44209090,INDIAN WOODEN BOX Wooden Spice Box,*****,*****,164,India,United Kingdom,
80070090,"INDIAN 8"" Tin Plate Spice Box - KC279",*****,*****,70,India,United Kingdom,
09103010,Turmeric Spice Blend other details as pe,*****,*****,1499,India,United Kingdom,
34060010,WAX CANDLES - 15OZ ECO WIX FESTIVE SPICE,*****,*****,498,India,United Kingdom,
09093129,SPICES- CUMIN POWDER,*****,*****,15,India,United Kingdom,
09093129,SPICES-CUMIN WHOLE,*****,*****,15,India,United Kingdom,
09109100,SPICE MIX FOR SAMBHAR POWDER 200GMS - UK,*****,*****,120,India,United Kingdom,
09109100,"ASSORTED SPICES ,FOODSTUFFS AND GENERAL",*****,*****,40,India,United Kingdom,
09109100,SPICE MIX FOR FISH MASALA 200GMS -# UK -,*****,*****,36,India,United Kingdom,
09109100,SPICE MIX FOR CHICKEN MASALA 200GMS - UK,*****,*****,120,India,United Kingdom,
09109100,SPICE MIX FOR MEAT MASALA 200GMS - UK -,*****,*****,120,India,United Kingdom,
09109100,"ASSORTED SPICES ,FOODSTUFFS AND GENERAL",*****,*****,40,India,United Kingdom,
21039090,HOLY LAMA CHAI SPICE EXTRACT 100 ML,*****,*****,4,India,United Kingdom,
21039090,HOLY LAMA PUMPKIN SPICES EXTRACT 5ML,*****,*****,96,India,United Kingdom,
21039090,HOLY LAMA SAFFRON AND SPICES NATURAL EXT,*****,*****,4,India,United Kingdom,
21039090,HOLY LAMA MULLING SPICES NATURAL EXTRACT,*****,*****,3,India,United Kingdom,
21039090,HOLY LAMA CHAI SPICE BLEND 1 LITRE,*****,*****,20,India,United Kingdom,
09023090,Pumpkin Spiced Herbal Tea - Black Tea,*****,*****,306,India,United Kingdom,
09023090,Turmeric Spiced Herbal Tea Tisane - Blac,*****,*****,120,India,United Kingdom,
09023090,Vanilla Spiced Chai Tea - Black Tea,*****,*****,144,India,United Kingdom,
09023090,Vanilla Spiced Masala Chai - Black Tea,*****,*****,72,India,United Kingdom,
09023090,Double Spice Masala Chai - Black Tea,*****,*****,120,India,United Kingdom,
09109100,MEAT CURRY SPICE MIX,*****,*****,2000,India,United Kingdom,
09109100,BIRYANI MASALA SPICE MIX,*****,*****,2080,India,United Kingdom,
09109100,CHICKEN KORMA SPICE MIX,*****,*****,3520,India,United Kingdom,
09109100,TANDOORI CHICKEN SPICE MIX,*****,*****,2000,India,United Kingdom,
09109100,MUTTON DUM BIRYANI SPICE MIX,*****,*****,2000,India,United Kingdom,
09109100,DAL MAKHANI SPICE MIX,*****,*****,2000,India,United Kingdom,
09109100,KADAI CHICKEN SPICE MIX,*****,*****,2000,India,United Kingdom,
09109100,MUTTON ROGAN JOSH SPICE MIX,*****,*****,2000,India,United Kingdom,
09109100,CHICKEN TIKKA MASALA SPICE MIX,*****,*****,3920,India,United Kingdom,
09109100,AFGHANI CHICKEN SPICE MIX,*****,*****,2000,India,United Kingdom,
09109100,CHICKEN CURRY SPICE MIX,*****,*****,2400,India,United Kingdom,
09109100,TANDOORI FISH SPICE MIX,*****,*****,2000,India,United Kingdom,
09109100,CREAMY CHICKEN SPICE MIX,*****,*****,3280,India,United Kingdom,
09109100,PANEER TIKKA SPICE MIX,*****,*****,2000,India,United Kingdom,
09109100,RAJMA MASALA SPICE MIX,*****,*****,2000,India,United Kingdom,
09109100,PUNJABI CHANA SPICE MIX,*****,*****,2000,India,United Kingdom,
09109100,PANEER BUTTER MASALA SPICE MIX,*****,*****,2400,India,United Kingdom,
09109100,FISH CURRY SPICE MIX,*****,*****,1920,India,United Kingdom,
09109100,LEMON HERB CHICKEN SPICE MIX,*****,*****,2320,India,United Kingdom,
09109100,SHAHI PANEER SPICE MIX,*****,*****,2400,India,United Kingdom,
09109100,HYDERABADI CHICKEN BIRYANI SPICE MIX,*****,*****,3920,India,United Kingdom,
09109100,BUTTER CHICKEN SPICE MIX,*****,*****,2400,India,United Kingdom,
09109100,DUM ALOO SPICE MIX,*****,*****,2000,India,United Kingdom,
39249090,EMPTY STEEL SPICE BOX,*****,*****,24,India,United Kingdom,
20019000,GARLIC PASTE - SPICES NEST BRAND PKD IN,*****,*****,1800,India,United Kingdom,
09109100,PUNCH POORAN 5 SPICE MIX PACKING: 20X,*****,*****,200,India,United Kingdom,
09109100,SPICES MASALA POWDER & PASTE - Spice - S,*****,*****,532.80,India,United Kingdom,
09109100,SPICES MASALA POWDER & PASTE - Spice-Pul,*****,*****,532.80,India,United Kingdom,
09109100,SPICES MASALA POWDER & PASTE - Spice - S,*****,*****,144,India,United Kingdom,
09109100,PUNCH POORAN 5 SPICE MIX PACKING: 20X,*****,*****,200,India,United Kingdom,
090002,CRACKED BLACK PEPPER AND BLACK PEPPER AND GROUND BLACK PEPPER AND MIXED SPICE,*****,*****,800,India,United Kingdom,
73239390,STAINLESS STEEL BIG Spice box,*****,*****,91,India,United Kingdom,
09109914,"ASSORTED SPICES, GENERAL ITEMS & PRINTED",*****,*****,50,India,United Kingdom,
09109100,Bayleaf Spice herbal Powder BATCH NO:TAL,*****,*****,10,India,United Kingdom,
22060000,Raisin Spice Liquid BATCH NO:DRK046S,*****,*****,15,India,United Kingdom,
22060000,Jeera Spice Liquid BATCH NO:JE028S,*****,*****,15,India,United Kingdom,
